{
  "schema_version": "1.0",
  "case_id": "CASE-MILLENNIUM-2027",
  "company": "Example Corp",
  "role": "Analyst",
  "created_at": "2026-08-11T09:00:00Z",
  "status": "diagnostic_pending",
  "jd": {
    "source_type": "pasted",
    "source": "Synthetic fixture posting.",
    "captured_at": "2026-08-11T09:00:00Z",
    "sha256": "0000000000000000000000000000000000000000000000000000000000000000"
  },
  "documents": {
    "quant_cv": {
      "document_id": null,
      "url": null,
      "baseline_revision_id": null,
      "baseline_page_count": null,
      "style": {
        "font_family": "Times New Roman",
        "bullet_font_size_pt": 11,
        "line_spacing": "single",
        "page_limit": 1,
        "preserve_margins": true
      }
    },
    "fundamental_resume": {
      "document_id": null,
      "url": null,
      "baseline_revision_id": null,
      "baseline_page_count": null,
      "style": {
        "font_family": "Times New Roman",
        "bullet_font_size_pt": 11,
        "line_spacing": "single",
        "page_limit": 1,
        "preserve_margins": true
      }
    },
    "cover_letter": {
      "document_id": null,
      "url": null,
      "baseline_revision_id": null,
      "baseline_page_count": null,
      "style": {
        "font_family": "Times New Roman",
        "bullet_font_size_pt": 11,
        "line_spacing": "single",
        "page_limit": 1,
        "preserve_margins": true
      }
    }
  },
  "selected_track": null,
  "fit_score": null,
  "score_weights": {
    "core_responsibilities": 35,
    "hard_skills": 30,
    "domain_experience": 20,
    "soft_skills": 10,
    "ats_terms": 5
  },
  "research_sources": [],
  "change_sets": [],
  "approvals": [],
  "eligibility_gate": "PASS",
  "eligibility_note": "International applicants welcome — synthetic fixture posting.",
  "language_gate": "PASS",
  "language_note": "English required; candidate declares fluent English (FACT-LANG-001)."
}
